id,title,description,admission_requirements,recommended_skills,entrance_exams,language_requirements
250,Public law,"Public law is a branch of law that deals with the relationship between individuals and the state. It includes areas such as constitutional law, administrative law, and criminal law. Public law sets out the rules that govern how public authorities operate and interact with citizens. It protects the rights and freedoms of people while ensuring the government acts within the law. Students in this specialization learn about the structure of government, the legal limits on power, and methods to resolve disputes between the state and individuals. It also covers the procedures for creating and enforcing laws. Public law is essential for maintaining order and justice in society. Graduates can work in government, legal practice, or international organizations. This field requires strong analytical and communication skills. It is a challenging yet rewarding area for those interested in law and public service.",Applicants usually need a high school diploma or equivalent. Some universities require passing an entrance examination. A background in social studies or humanities may be beneficial.,"Critical thinking, strong communication, analytical skills, attention to detail, and interest in government and society.","Common entrance exams include national university entrance tests or specific law faculty tests, depending on the country.","Most programs require proficiency in the language of instruction, often proven by tests like IELTS or TOEFL for English-taught programs."
249,International law,"International law is a field of study that focuses on the rules and agreements that govern relationships between countries. It covers topics such as treaties, human rights, trade, and conflict resolution. Students learn about the legal systems of different countries and how international organizations, like the United Nations, operate. The specialization also explores how international laws are created, interpreted, and enforced. It is important for understanding global issues and finding peaceful solutions to international problems. Graduates often work as diplomats, legal advisors, or in international organizations. The field requires strong analytical and communication skills. Knowledge of history, politics, and culture is also useful. International law is always changing, so students must be ready to learn new things. Overall, it helps promote justice and cooperation around the world.",Typically requires a high school diploma or equivalent. Some universities may ask for background in social sciences or humanities.,"Critical thinking, communication, research, problem-solving, and an interest in global affairs.","May require standardized tests like SAT, ACT, or university-specific entrance exams.","Proficiency in English or the language of instruction, often proven by tests like IELTS or TOEFL."
248,Civil law,"Civil law is a branch of law that deals with the rights and duties of individuals in their private relationships. It covers areas such as contracts, property, family law, and torts. Civil law aims to resolve disputes between people and organizations fairly. It is different from criminal law, which deals with crimes and punishments. Civil law helps to protect people's rights and ensures justice in society. Professionals in this field often work as lawyers, judges, or legal advisors. They help clients with legal documents, represent them in court, and give advice on legal issues. A good understanding of laws and regulations is important in this field. Civil law is essential for maintaining order and protecting citizens’ interests. It also plays a key role in business and everyday life.","Applicants usually need a high school diploma or equivalent. Some universities may require good grades in social studies, history, or language subjects. A strong academic record is often preferred.","Analytical thinking, good communication skills, attention to detail, problem-solving abilities, and strong writing skills are important for success in civil law.","Many universities require entrance exams such as the LSAT or a general university entrance test, depending on the country.","Most programs require proficiency in the language of instruction, often proven by tests like IELTS or TOEFL for English, or local language tests for other countries."
247,Criminal law,"Criminal law is the branch of law that deals with crimes and their punishment. It focuses on actions that are considered harmful to society as a whole. Students learn about different types of crimes, such as theft, assault, and murder. The specialization covers how laws are made, enforced, and interpreted in court. It also explores the rights of the accused and the responsibilities of law enforcement. Courses often include case studies and real-life examples to help students understand legal processes. Graduates can work as lawyers, prosecutors, or legal advisors. This field requires strong analytical and critical thinking skills. It is important for those interested in justice and public safety. Criminal law plays a key role in maintaining order and protecting citizens.","A high school diploma or equivalent, with good grades in social sciences or humanities. Some universities may require entrance exams or interviews.","Critical thinking, analytical reasoning, good communication, attention to detail, and ethical judgment.",Some programs may require standardized tests like the LSAT or a university-specific entrance exam.,"Usually requires proficiency in the language of instruction, demonstrated by tests like IELTS or TOEFL for non-native speakers."
246,Social problems,"Social problems is a specialization that focuses on understanding the challenges and issues that affect societies. Students learn about topics like poverty, crime, inequality, discrimination, and environmental issues. The program teaches how these problems develop and what solutions can be used to address them. It encourages critical thinking about the causes and effects of social issues. Students will study real-world examples and learn effective research methods. The course also covers the impact of social problems on different groups within society. Graduates can work in social services, policy-making, education, or non-profit organizations. The specialization helps students develop empathy and a deeper understanding of their communities. It prepares them to contribute positively to society. Social problems is ideal for those who want to make a difference in the world.",High school diploma or equivalent; basic understanding of social studies; motivation to learn about social issues.,"Critical thinking, communication, research skills, empathy, problem-solving, and teamwork.",Some programs may require entrance exams in social studies or general knowledge.,"Intermediate (B2) level in the language of instruction, usually English or the local language."
245,Social work,"Social work is a field focused on helping individuals, families, and communities improve their well-being and solve personal or social problems. Social workers support people facing challenges such as poverty, family issues, addiction, or mental health concerns. They work in a variety of settings, including schools, hospitals, community centers, and government agencies. Social workers provide counseling, connect clients to resources, and advocate for social justice and human rights. This profession requires compassion, patience, and strong communication skills. Social work plays a vital role in building healthier and more supportive communities. Social workers also help during crises, such as natural disasters or family emergencies. They often work with vulnerable populations, such as children, the elderly, or people with disabilities. Social work can be emotionally demanding but is also rewarding. Social workers must respect confidentiality and act with integrity in all situations.",,,,
244,Ethnology,"Ethnology is the scientific study of different cultures and societies around the world. It examines how people live, their traditions, beliefs, and social structures. Ethnologists often compare cultures to understand their similarities and differences. They use fieldwork, interviews, and observation to gather information about communities. This specialization helps to promote tolerance and respect among diverse groups. Ethnologists also look at how cultures change over time due to factors like migration or globalization. Their findings are important for museums, cultural organizations, and educational institutions. Ethnology often works together with anthropology and sociology. It can help solve social problems by providing insights into human behavior. Graduates can work in research, teaching, cultural heritage, or international organizations.",High school diploma or equivalent; some universities may require a background in social sciences or humanities.,"Interest in different cultures, communication, analytical thinking, observation, open-mindedness, and research skills.",Usually requires a general university entrance exam; some institutions might have specific tests or interviews.,Proof of proficiency in the language of instruction (such as English or the local language); international students may need tests like IELTS or TOEFL.
243,Anthropology,"Anthropology focuses on the study of human societies, cultures, and social development across time and regions. The program explores cultural traditions, social structures, human evolution, and the ways communities interact with their environments. Students study cultural anthropology, archaeology, linguistic anthropology, and biological anthropology while developing research and analytical skills used to understand human behavior and cultural diversity. This field is suitable for individuals interested in human cultures, social systems, and understanding how societies develop and change in different historical and global contexts.",,,,
242,Demography,"Demography is the scientific study of populations, including their size, structure, and distribution. It examines how populations change over time due to births, deaths, migration, and aging. Demographers collect and analyze data to understand trends and patterns in human populations. This field helps governments and organizations plan for the future by providing important information about population growth and decline. Demographers use statistics and mathematical models to make predictions and inform policy decisions. The study of demography is important for areas like public health, education, housing, and employment. It also helps us understand social changes and challenges in different countries. People who work in demography often use surveys, censuses, and other data sources. The field requires good analytical and problem-solving skills. Demography is essential for making decisions that improve societies and people’s lives.","Applicants usually need a high school diploma or equivalent, with good grades in mathematics and social sciences. Some universities may require specific courses in statistics or economics.","Strong analytical skills, attention to detail, proficiency in mathematics and statistics, good communication skills, and the ability to work with data and computers.","Entrance exams depend on the country and university. Common exams include SAT, ACT, or university-specific tests. Some programs may require mathematics or general knowledge tests.","Most programs require proficiency in the language of instruction, such as English. International students may need to provide TOEFL or IELTS scores as proof of English proficiency."
241,Comparative education,"Comparative education is the study of educational systems, processes, and outcomes in different countries or regions. It explores how factors like culture, history, politics, and economics shape education around the world. Students learn to analyze and compare various educational models and policies. This specialization helps understand best practices and challenges in global education. It often involves research, fieldwork, and critical analysis of international education systems. Graduates can work in policy-making, international organizations, or educational consultancy. The field encourages open-mindedness and cross-cultural understanding. It also addresses issues such as educational equity, reform, and innovation. Comparative education prepares students to contribute to educational development globally. Overall, it is a dynamic and interdisciplinary field.",A completed secondary education certificate or equivalent is required. Some institutions may ask for transcripts showing good academic performance. A motivation letter or statement of purpose may also be needed.,Strong analytical and critical thinking skills are important. Interest in different cultures and education systems is helpful. Research and communication skills are also recommended.,"Most programs do not require specific entrance exams, but some may ask for a general university entrance test.",Proficiency in the language of instruction (often English) is required. Some programs may ask for proof of language skills through tests like IELTS or TOEFL.
240,Special education,"Special education is a field focused on teaching students who have different learning needs or disabilities. This specialization prepares teachers to work with children who may have physical, emotional, intellectual, or behavioral challenges. Special education teachers learn how to create lesson plans that fit each student’s unique abilities. They also use special teaching methods and tools to help students succeed in school. The program covers topics such as classroom management, assessment, and adapting curriculum. Teachers are trained to work with families and other professionals to support students. This specialization is important because it helps every child reach their full potential. Graduates can work in public or private schools, special education centers, or provide support in regular classrooms. The demand for special education teachers is growing in many countries. This career is rewarding for those who are patient, creative, and passionate about helping others.","Most programs require a high school diploma or equivalent. Some universities may ask for a background in education or related fields. Transcripts, a personal statement, and letters of recommendation are often needed.","Patience, empathy, strong communication skills, creativity, adaptability, and problem-solving abilities are important. Experience working with children or people with disabilities is helpful.",Entrance exams depend on the country and university. Some may require a general university entrance exam or a test of language skills.,"Usually, a B2 level of English or the language of instruction is required. Proof may be needed through exams like IELTS, TOEFL, or local language tests."
239,Teaching and instruction,"The specialization in Teaching and Instruction prepares students to become effective educators in various educational settings. It covers important topics such as lesson planning, classroom management, and assessment techniques. Students learn how to design engaging learning activities and adapt teaching methods for diverse learners. The program emphasizes both theoretical knowledge and practical experience through internships or teaching practice. Graduates are equipped to teach at primary, secondary, or even adult education levels. They study educational psychology to understand how students learn best. The curriculum also includes courses on educational technology and inclusion. Communication and leadership skills are strongly developed. This specialization is suitable for those passionate about helping others learn. Upon completion, graduates can pursue careers as teachers, trainers, or education consultants.",Applicants typically need a high school diploma or equivalent. Some programs may require a background in education or related fields. Submission of transcripts and a personal statement is common.,"Strong communication, patience, creativity, organization, and a passion for teaching are recommended skills. Problem-solving and adaptability are also important.",Some institutions may require entrance exams or interviews to assess suitability for the program. Requirements vary by country and institution.,"A good command of the language of instruction is necessary. Non-native speakers may need to provide proof of language proficiency, such as TOEFL or IELTS scores."
238,Education systems,"The education systems specialization focuses on how countries and societies organize schools and learning institutions. It examines the structure, policies, and goals of education at different levels, such as primary, secondary, and higher education. Students learn about international comparisons of education systems, including curriculum design and assessment methods. This specialization explores issues like access to education, equality, and quality of teaching. It also covers the role of governments, private organizations, and technology in education. Students can analyze the impact of culture and economics on schools. The program prepares graduates to improve or advise on education systems. Research and practical projects are often part of the studies. Careers may include policy analysis, educational consulting, or administration. This specialization is ideal for those interested in making a difference in how people learn worldwide.",A high school diploma or equivalent is typically required. Some programs may require a bachelor's degree for advanced studies. Transcripts and recommendation letters are often requested.,"Critical thinking, communication, problem-solving, research skills, and teamwork are recommended. An interest in education and social issues is helpful.",Some universities may require general entrance exams or subject-specific tests. Requirements vary by country and institution.,"If the program is in English, proof of English proficiency is usually required (such as IELTS or TOEFL). Other languages may be required depending on the country and program."
237,Business and Management,"Business and Management is a specialization focused on understanding how organizations operate and grow. It covers topics such as leadership, marketing, finance, and human resources. Students learn how to make strategic decisions and solve problems in real business situations. The program develops skills in planning, organizing, and controlling business activities. It also teaches effective communication and teamwork. Business and Management prepares students for careers in various industries, including banking, consulting, and retail. The course includes case studies and group projects to give practical experience. Students are encouraged to think critically and creatively. The specialization also explores global business trends and ethical issues. Graduates can work as managers, analysts, or entrepreneurs.",A high school diploma or equivalent is typically required. Some programs may ask for a background in mathematics or economics.,"Strong analytical thinking, communication, leadership, teamwork, and problem-solving skills are recommended.","Some universities may require entrance exams such as SAT, ACT, or institution-specific tests.","Proof of English proficiency, such as IELTS or TOEFL, is often required for non-native speakers."
236,Industrial relations,"Industrial relations is a field of study that focuses on the relationship between employers, employees, and the institutions that regulate them. It explores how workplace conflicts are managed and how cooperation can be achieved. Students learn about labor laws, collective bargaining, and the history of unions. The specialization covers topics such as dispute resolution, labor market trends, and workplace safety. It also examines the impact of globalization and technology on employment relations. Industrial relations specialists help create fair and productive work environments. They advise on conflict management and employee rights. Graduates can work in human resources, labor unions, or government agencies. The field requires understanding of both business and social issues. It is important for anyone interested in improving workplace harmony and productivity.",High school diploma or equivalent; some universities may require specific subjects such as economics or social studies.,"Good communication, problem-solving, negotiation skills, and an interest in law and human behavior.",Varies by country and institution; may include general university entrance exams or specific tests in social sciences.,"Usually requires proficiency in the language of instruction (e.g., English or local language); international students may need to provide TOEFL or IELTS scores."
235,Econometrics,"Econometrics is a field that combines economics, mathematics, and statistics to analyze data and test economic theories. It helps researchers and policymakers understand relationships between variables, such as income and spending. Students learn to use statistical software and interpret real-world data. Econometrics is important for making predictions and supporting decisions in business and government. The specialization covers topics like regression analysis, time series, and forecasting. It requires a good understanding of economic concepts and quantitative skills. Graduates can work in research, finance, consulting, or public policy. The field is constantly evolving with new data and methods. Teamwork and problem-solving are important in econometrics. This specialization is ideal for students interested in applying mathematics to solve economic problems.","Usually, a high school diploma with strong grades in mathematics and economics is required. Some programs may require entrance exams or interviews.","Strong analytical skills, mathematics, logical thinking, and attention to detail. Basic knowledge of economics and statistics is helpful.",Some universities may require entrance exams in mathematics or economics.,"Proficiency in the language of instruction, often English, proven by standardized tests like IELTS or TOEFL if not a native speaker."
234,Economics,"This field focuses on how economies function, including the production, distribution, and consumption of goods and services at both micro and macro levels. Students learn economic theory, market behavior, public policy, international economics, and quantitative analysis while developing analytical and critical thinking skills. It is suitable for individuals interested in understanding economic systems, policy-making, market trends, and roles that require data-driven economic analysis.",,,,
233,Clinical psychology,"Clinical psychology is a specialization within psychology that focuses on diagnosing and treating mental, emotional, and behavioral disorders. Professionals in this field help people manage problems ranging from short-term personal issues to severe, chronic conditions. Clinical psychologists use interviews, observations, and psychological tests to assess patients. They create and implement treatment plans that may involve therapy, counseling, or behavior modification. Their work often includes helping individuals cope with stress, trauma, anxiety, depression, and other mental health challenges. Clinical psychologists can work in hospitals, private practices, schools, or research institutions. They also collaborate with other healthcare professionals to provide holistic care. This field requires strong communication and problem-solving skills. Ethical responsibility and empathy are key traits for success. Through their work, clinical psychologists aim to improve the mental well-being and quality of life for their patients.","Typically, a bachelor's degree in psychology or a related field is required. Some programs may require relevant work or volunteer experience.","Strong communication skills, empathy, analytical thinking, problem-solving abilities, and ethical awareness.","Entrance exams may include the GRE (Graduate Record Examination) or local university-specific exams, depending on the country and institution.","Proficiency in the language of instruction, often demonstrated by tests like TOEFL or IELTS for English-taught programs."
232,Psychometrics,"Psychometrics is a field that focuses on the theory and technique of psychological measurement. It deals with the design, analysis, and interpretation of tests that measure abilities, attitudes, personality traits, and other psychological variables. Psychometricians create and improve tools like questionnaires, tests, and assessments used in education, psychology, and employment. They use statistics to ensure that these tools are reliable and valid. Psychometrics is important for fair and accurate measurement of human characteristics. It helps professionals make informed decisions based on test results. The field is constantly evolving with new methods for data analysis. Psychometricians often work with big data and technology. The specialization is useful in schools, companies, hospitals, and research. It combines psychology, mathematics, and data science.","Typically, a bachelor's degree in psychology, education, statistics, or a related field is required. Some programs may also require relevant work or research experience.","Strong skills in mathematics, statistics, data analysis, logical thinking, and an interest in human behavior are recommended.","Some universities may require GRE or equivalent entrance exams, depending on the country and program.","Most programs require proof of English proficiency, such as TOEFL or IELTS, for non-native speakers."
