id,title,description,admission_requirements,recommended_skills,entrance_exams,language_requirements
151,Mining and mineral processing,"Mining and mineral processing is a field that focuses on the extraction of valuable minerals from the earth and their transformation into usable products. Students learn about different methods of mining, such as surface and underground mining. The program also teaches techniques for processing minerals, including crushing, grinding, and separating valuable materials from waste. Environmental protection and sustainable practices are important parts of this specialization. Students study how to reduce the environmental impact of mining activities. The field also involves safety management and the efficient use of resources. Modern technology, like automation and digital monitoring, is increasingly used in this industry. Graduates can work in mining companies, mineral processing plants, or environmental agencies. The program combines engineering, geology, and chemistry. It prepares students for a dynamic and challenging career in the minerals sector.","Applicants usually need a high school diploma with a strong background in mathematics, physics, and chemistry. Some universities may require a minimum grade point average or specific subject prerequisites.","Strong analytical and problem-solving skills, attention to detail, teamwork, communication skills, and an interest in earth sciences and engineering are recommended.","Entrance exams may include mathematics and science subjects, depending on the university and country. Some institutions may also require a general university entrance exam.","Most programs require proficiency in the language of instruction, such as English. International students may need to provide TOEFL, IELTS, or equivalent test scores."
150,Remote sensing,"Remote sensing is a scientific field that involves collecting information about the Earth's surface without making physical contact. This is usually done with the help of satellites, drones, or aircraft equipped with special sensors and cameras. In remote sensing, data such as images, temperature, and even chemical composition can be gathered from a distance. These data are useful for mapping, monitoring environmental changes, and managing natural resources. Remote sensing is important in agriculture, disaster management, forestry, and urban planning. Professionals in this field analyze and interpret data to help solve real-world problems. They often work with Geographic Information Systems (GIS) to create maps and models from the collected data. Remote sensing technology is always improving, making it possible to get more accurate and detailed information. This specialization combines knowledge from geography, physics, computer science, and environmental science. It is a growing field with many opportunities for research and practical applications.","Typically, a high school diploma with strong grades in mathematics, physics, and geography is required. Some programs may require prior coursework in computer science or related sciences.","Analytical thinking, attention to detail, computer literacy, problem-solving skills, and an interest in technology and the environment.","Some universities may require entrance exams in mathematics, physics, or general science, while others may rely on general university admission tests.","If the program is taught in English, proof of English proficiency such as TOEFL or IELTS may be required for non-native speakers."
149,Energy and fuels,"The Energy and Fuels specialization focuses on the study of energy sources and how they are converted into usable power. Students learn about conventional fuels like coal, oil, and natural gas, as well as renewable sources such as solar, wind, and biofuels. The program explores the science behind energy production, storage, and usage. It covers environmental impacts, efficiency, and sustainability of different fuels. Students also examine energy policies and global energy demand. Laboratory work and practical projects help students gain hands-on experience. Graduates can work in energy companies, environmental agencies, or research institutions. The specialization prepares students to solve challenges in the energy sector. It encourages innovative thinking for future energy solutions. This field is essential for those interested in sustainable development and environmental protection.",High school diploma or equivalent with strong grades in science and mathematics. Some programs may require a background in physics or chemistry.,"Analytical skills, problem-solving abilities, teamwork, communication skills, and an interest in science and technology.","Some universities may require entrance exams in mathematics, physics, or general science.","Proficiency in the language of instruction, often proven by standardized tests like IELTS or TOEFL for English-taught programs."
148,Petroleum engineering,"Petroleum engineering is a field of engineering focused on the exploration, extraction, and production of oil and natural gas. It combines knowledge from geology, chemistry, physics, and mathematics to solve complex problems related to energy resources. Petroleum engineers design and develop methods for drilling wells and managing oil and gas reservoirs efficiently. They work both in offices and at drilling sites to ensure safe and cost-effective operations. The specialization also involves evaluating new technologies to improve extraction and reduce environmental impact. Petroleum engineers often collaborate with geologists and other specialists to assess potential drilling locations. They must monitor and maintain equipment to ensure it functions properly. This field is vital for meeting global energy demands. Graduates can work in oil companies, service firms, or research institutions. The job may require travel and working in remote locations.","Applicants usually need a high school diploma with strong grades in mathematics, physics, and chemistry. Some universities may require entrance exams or interviews.","Strong analytical and problem-solving skills, good communication, teamwork, attention to detail, and technical aptitude in math and science.","Common entrance exams include SAT, ACT, or university-specific tests. Some countries may require a national engineering entrance exam.","Most programs require proof of English proficiency, such as IELTS or TOEFL scores, if the applicant's first language is not English."
147,Geotechnics,"Geotechnics is a branch of civil engineering focused on the behavior of earth materials. It involves studying soil, rocks, and groundwater to design safe and stable foundations for structures. Geotechnical engineers assess the ground conditions at construction sites and recommend suitable building methods. They help design foundations, retaining walls, tunnels, and embankments. Their work is essential for projects like roads, bridges, and dams. Geotechnics combines field investigations, laboratory tests, and computer modeling. The field also addresses natural hazards such as landslides and earthquakes. Geotechnical engineers work closely with other engineers and construction teams. They ensure structures are safe, cost-effective, and environmentally friendly. This specialization is important for sustainable and resilient infrastructure.","Typically, a high school diploma with strong grades in mathematics, physics, and chemistry. Some universities may require entrance exams or interviews.","Analytical thinking, problem-solving, teamwork, good communication, attention to detail, and a strong background in math and science.",Varies by country and university; often includes mathematics and science subjects.,"Proof of proficiency in the language of instruction, such as IELTS or TOEFL for English-taught programs."
146,Geological engineering,"Geological engineering is a field that combines geology and engineering to solve problems related to the Earth. Geological engineers study rocks, soil, groundwater, and natural hazards to design safe structures and resource extraction methods. They work on projects like tunnels, dams, mines, and roads, making sure these are stable and secure. Their work is important for protecting the environment and ensuring public safety. Geological engineers often analyze data from field surveys and laboratory tests. They use computers and special software to model geological processes. The field also involves risk assessment for natural disasters like landslides and earthquakes. Geological engineers often collaborate with other specialists, such as civil engineers and environmental scientists. Their expertise is crucial in the search and management of natural resources like minerals, oil, and gas. This specialization offers a dynamic career with opportunities in both public and private sectors.","Typically, applicants need a high school diploma with strong grades in mathematics, physics, and chemistry. Some universities may require specific science courses or a minimum GPA. Letters of recommendation and a personal statement are often requested.","Strong analytical and problem-solving skills, attention to detail, teamwork, good communication, and a solid foundation in mathematics and science are important. Fieldwork skills and computer literacy are also valuable.","Some universities require standardized entrance exams like SAT, ACT, or institution-specific tests. In some countries, national exams in mathematics and science are required.","If the program is taught in English, proof of English proficiency (such as IELTS or TOEFL) is usually needed for non-native speakers. Local language requirements may apply for programs taught in other languages."
145,Diagnostic technologies,"Diagnostic technologies is a specialization that focuses on the tools and methods used to detect, monitor, and analyze diseases and health conditions. Students learn about laboratory equipment, imaging devices, and advanced software used in medical diagnostics. The program covers topics such as clinical chemistry, molecular diagnostics, and medical imaging techniques like MRI and CT scans. Emphasis is placed on understanding how these technologies help doctors make accurate diagnoses. Students also study the principles of quality control and safety in diagnostic laboratories. Practical training is included to develop hands-on skills with real diagnostic instruments. Graduates are prepared to work in hospitals, clinics, and research labs. They play a key role in supporting doctors and improving patient care. The specialization keeps up with new advancements in the field, such as AI in diagnostics. It is ideal for those interested in healthcare technology and laboratory science.","Typically requires a high school diploma with good grades in science subjects such as biology, chemistry, and physics. Some programs may require an entrance interview or basic knowledge assessment.","Attention to detail, analytical thinking, technical aptitude, communication skills, and a strong interest in science and technology.","Some institutions may require entrance exams in science subjects or general aptitude tests, depending on the country and university.","If the program is taught in English, non-native speakers may need to provide proof of English proficiency, such as IELTS or TOEFL scores."
144,Medical laboratory technology,"Medical Laboratory Technology is a specialized field in the medical sciences that focuses on laboratory analysis of body fluids and tissues. Professionals in this area play a vital role in diagnosing diseases by performing complex tests using advanced laboratory equipment. They work closely with doctors and other healthcare providers to ensure accurate and timely results. The field covers various disciplines such as hematology, microbiology, clinical chemistry, and immunology. Medical laboratory technologists are trained to handle and process patient samples with care and precision. They must follow strict safety protocols to prevent contamination and errors. This specialization also involves maintaining laboratory instruments and ensuring quality control in all procedures. Technologists are required to keep up with new developments in laboratory technology and medical research. The work environment can be in hospitals, clinics, research laboratories, or blood banks. Overall, Medical Laboratory Technology is essential for effective healthcare and patient management.","Applicants are typically required to have completed secondary education with a strong background in science subjects such as biology, chemistry, and physics. Some institutions may also require a minimum grade point average or equivalent academic performance. In certain cases, a personal interview or entrance test may be part of the selection process.","Attention to detail, analytical thinking, good communication skills, ability to work under pressure, teamwork, and proficiency in using laboratory equipment are recommended skills for this specialization.",Some universities or colleges may require entrance exams in science subjects or a general aptitude test as part of the admission process. Examples include university-specific entrance tests or national standardized exams where applicable.,"Most programs require proficiency in the language of instruction, often English. Proof of language proficiency, such as TOEFL or IELTS scores, may be needed for non-native speakers."
143,Textiles,"Textiles is a field that focuses on the creation, design, and production of fabrics and materials used in clothing, furniture, and many other products. Students learn about different fibers, weaving techniques, dyeing methods, and fabric finishing. The specialization covers both traditional and modern technologies in textiles. It explores the scientific and artistic aspects of fabric creation. There is a strong emphasis on sustainability and innovation in textile production. Students also study fashion trends, quality control, and textile management. The field is important for industries such as fashion, interior design, and automotive. Practical experience in laboratories and workshops is a key part of the program. Graduates can work as textile designers, production managers, or quality controllers. This specialization is suitable for creative individuals interested in both art and technology.",Applicants should have completed secondary education or equivalent. Some programs may require a background in science or art subjects.,"Creativity, attention to detail, manual dexterity, interest in materials and design, problem-solving skills, and basic scientific understanding.","Entrance exams may include tests in art, science, or general aptitude, depending on the institution.","Usually, proof of proficiency in the language of instruction (such as English or the local language) is required."
142,Paper and wood,"The Paper and Wood specialization focuses on the study and processing of plant-based materials to create paper, cardboard, and wood products. Students learn about the properties and uses of different types of wood and pulp. The program covers modern techniques for sustainable forest management, paper production, and recycling. It also explores the environmental impact and eco-friendly practices in the industry. Students gain hands-on experience with machinery and laboratory equipment. The curriculum includes courses in chemistry, material science, and engineering. Graduates can work in paper mills, wood processing plants, or research institutions. The field is important for industries such as packaging, publishing, and construction. Innovation and sustainability are key trends in this area. Problem-solving skills and attention to detail are highly valued in this field.",High school diploma with a focus on science subjects is usually required. Some institutions may require passing an entrance exam or interview.,"Good analytical skills, attention to detail, interest in environmental issues, teamwork, and basic laboratory skills are recommended.","Entrance exams may include questions on biology, chemistry, and general science.","Proficiency in the language of instruction, often English or the national language, is needed. Some programs may require a language test score."
141,Cermets,"Cermets are composite materials made by combining ceramic and metallic materials. They are designed to take advantage of the best properties of both ceramics and metals. Ceramics offer hardness, wear resistance, and the ability to withstand high temperatures, while metals provide toughness and the ability to absorb shock. Cermets are commonly used in applications where high temperature and wear resistance are important, such as in cutting tools and turbine blades. They are also used in the aerospace and automotive industries. The production of cermets involves careful control of the mixture and processing conditions. Cermets can be customized by changing the composition and structure to meet different needs. They are often more durable and efficient than pure metals or ceramics alone. Research in cermets is ongoing, aiming to find new combinations and improve their properties. Their unique characteristics make cermets an important area of materials science.","A background in materials science, engineering, or a related scientific field is usually required. Undergraduate coursework in chemistry, physics, and mathematics is helpful.","Analytical thinking, problem-solving, laboratory skills, and an interest in materials research are recommended. Familiarity with material characterization techniques is beneficial.","Some programs may require entrance exams such as GRE or equivalent, depending on the country and institution.","Non-native English speakers may need to provide proof of English proficiency through tests like TOEFL or IELTS, especially for international programs."
140,Plastics,"Plastics is a specialization focused on the study, design, and manufacturing of plastic materials and products. Students learn about different types of plastics, their properties, and applications in various industries. The program covers subjects such as polymer chemistry, processing techniques, and recycling methods. It also involves understanding the environmental impact of plastics and exploring sustainable alternatives. Students gain practical experience through laboratory work and internships. This specialization is important for developing new plastic materials with improved performance. Graduates can work in industries like packaging, automotive, electronics, and healthcare. They may also be involved in research and development of innovative plastic products. The program prepares students for both technical and managerial roles. Ethical and responsible use of plastics is also emphasized.","Typically requires a high school diploma with good grades in science subjects, especially chemistry and mathematics. Some institutions may require an entrance exam or interview.","Strong analytical and problem-solving skills, attention to detail, interest in chemistry and materials science, and good communication skills.",Some universities may require general science entrance exams or specific tests in chemistry and mathematics.,"Proof of proficiency in the language of instruction, such as English (IELTS/TOEFL) or other local language tests, may be required for international students."
139,Composites,"Composites specialization focuses on the study and application of materials made from two or more different substances. These materials combine to create products with unique and improved properties, such as strength, lightness, or resistance to heat and chemicals. Students learn about the design, manufacturing, and testing of composite materials. This field is important in industries like aerospace, automotive, construction, and sports equipment. The program covers topics such as polymers, fibers, resins, and advanced manufacturing techniques like lay-up and molding. Students also explore the environmental impact and recycling of composites. Hands-on laboratory work is a key part of the curriculum. Graduates can work as engineers, designers, or researchers. The specialization encourages innovation and problem-solving for real-world applications. It prepares students for a dynamic and growing industry.","Applicants need to have a high school diploma or equivalent, with strong grades in mathematics and science subjects.","Good understanding of physics and chemistry, problem-solving skills, attention to detail, and teamwork.","Depending on the country and university, entrance exams may include mathematics, physics, or general science tests.","Most programs require proficiency in English or the local language, proven by tests like TOEFL or IELTS for non-native speakers."
138,Coating and films,"Coating and Films is a scientific and engineering field that focuses on the development, application, and analysis of thin layers of materials applied to surfaces. These coatings can provide protection, improve appearance, or add specific functionalities such as anti-corrosion, waterproofing, or electrical conductivity. The specialization covers topics like material selection, surface preparation, deposition techniques, and testing methods. Students also learn about the physical and chemical properties of coatings and films. Applications are found in industries such as automotive, electronics, medical devices, and construction. Knowledge of eco-friendly and sustainable coatings is increasingly important. The field also explores innovations in nanotechnology and smart coatings. Research and lab work are a significant part of the curriculum. Graduates often work in research, product development, or quality control roles. The specialization combines elements of chemistry, physics, and engineering.","Applicants need a high school diploma with strong grades in science subjects, especially chemistry and physics. Some programs may require completion of basic mathematics courses.","Analytical thinking, attention to detail, problem-solving, laboratory skills, and teamwork are important. Interest in materials science and innovation is also beneficial.","Some universities may require entrance exams in science and mathematics, depending on the country and institution.","Non-native speakers may need to provide proof of English proficiency through tests like IELTS or TOEFL, or local equivalents."
137,Ceramics,"Ceramics is the art and science of making objects from clay and other materials that are hardened by heat. This specialization covers the techniques of hand-building, wheel-throwing, glazing, and firing ceramics. Students learn about the history and cultural significance of ceramics from different parts of the world. The program also explores modern applications in art, design, and industry. Practical classes help students develop both creative and technical skills. They experiment with different types of clay and surface treatments. Safety and proper use of equipment are important parts of the training. Students are encouraged to develop their own style and create original works. The specialization prepares graduates for careers as artists, designers, or educators. It also provides a strong foundation for further study or personal artistic development.",High school diploma or equivalent; portfolio may be required.,"Creativity, attention to detail, manual dexterity, patience, and an interest in art and design.",Some programs may require an art aptitude test or portfolio review.,"B2 level in the language of instruction, usually English or the local language."
136,Chemical process engineering,"Chemical process engineering is a field that focuses on designing, operating, and improving chemical processes in industries. It combines knowledge from chemistry, physics, mathematics, and engineering to create efficient and safe processes for producing chemicals, fuels, food, and other products. Chemical process engineers work on developing new processes, scaling up laboratory results for industrial use, and optimizing existing systems. They are involved in selecting equipment, controlling reactions, and ensuring environmental and safety standards. This specialization also includes troubleshooting plant operations and reducing costs. Chemical process engineers often collaborate with chemists, mechanical engineers, and environmental specialists. They use computer models to simulate processes and predict outcomes. Sustainability and innovation are key trends in this field. Graduates can work in sectors like pharmaceuticals, energy, food processing, and environmental technology. The profession supports the development of cleaner and more efficient industrial processes.","Typically, applicants should have completed secondary education with strong grades in mathematics, chemistry, and physics. Some universities may require entrance exams or interviews.","Strong analytical thinking, problem-solving abilities, teamwork, effective communication, attention to detail, and a solid foundation in mathematics and science.","Entrance exams may include mathematics, chemistry, and sometimes physics, depending on the university and country.","If the program is taught in English, proof of English proficiency such as IELTS or TOEFL may be required for non-native speakers."
