id,title,description,admission_requirements,recommended_skills,entrance_exams,language_requirements
736,Uncrewed Systems,"Uncrewed Systems focuses on the design, operation, and integration of systems that function without onboard human presence, including drones, robotic platforms, and remote sensing systems. Students learn control systems, sensors, communication, embedded systems, and system integration to operate and manage uncrewed technologies. The field suits individuals who are analytical, tech-oriented, and interested in robotics, automation, and advanced engineering systems.",,,,
735,Uncrewed and Autonomous Systems Engineering,"Uncrewed and Autonomous Systems Engineering focuses on designing, developing, and integrating autonomous technologies such as drones, robotic systems, and self-operating vehicles. Students learn control systems, robotics, artificial intelligence, embedded systems, sensors, and system integration to build intelligent systems that operate with minimal human intervention. The field suits individuals who are analytical, tech-oriented, and interested in robotics, automation, and advanced engineering systems.",,,,
734,Uncrewed Aircraft Systems,"Uncrewed Aircraft Systems focuses on the design, operation, and management of drones and remotely piloted aircraft. Students learn aerodynamics, flight control systems, navigation, sensors, communication systems, and aviation regulations to develop and operate unmanned aerial platforms. The field suits individuals who are technically oriented, detail-focused, and interested in aviation, robotics, and autonomous flight technologies.",,,,
733,Uncrewed & Autonomous Systems,"Uncrewed & Autonomous Systems focuses on the design, development, and operation of systems that function without direct human control, such as drones, autonomous vehicles, and robotic platforms. Students learn robotics, control systems, artificial intelligence, sensors, embedded systems, and navigation to build and manage autonomous technologies. The field suits individuals who are analytical, tech-oriented, and interested in robotics, automation, and intelligent systems.",,,,
732,Systems Engineering,"Systems Engineering focuses on designing, integrating, and managing complex systems across their entire lifecycle. Students learn systems thinking, modeling, optimization, project management, and interdisciplinary integration to ensure all components of a system work effectively together. The field suits individuals who are analytical, detail-oriented, and interested in solving complex problems by coordinating technical and organizational elements.",,,,
731,Space Systems,"Space Systems focuses on the design, integration, and operation of spacecraft, satellites, and related technologies. Students learn systems engineering, spacecraft design, control systems, embedded systems, and mission integration to develop and manage complex space technologies. The field suits individuals who are analytical, technically skilled, and interested in engineering systems for space exploration and satellite operations.",,,,
730,Space Physics,"Space Physics focuses on studying physical processes in space, including solar activity, planetary magnetospheres, cosmic radiation, and interactions between the Sun and Earth. Students learn physics, electromagnetism, plasma physics, and data analysis to understand space environments and their impact on satellites and communication systems. The field suits individuals who are analytical, research-oriented, and interested in astrophysics, space science, and fundamental physical phenomena.",,,,
729,Space Operations,"Space Operations focuses on the planning, control, and management of space missions, satellites, and ground systems. Students learn orbital mechanics, spacecraft systems, mission planning, space environment, and data analysis to operate and support space missions. The field suits individuals who are analytical, technically skilled, and interested in space technology, mission control, and aerospace operations.",,,,
728,Software Engineering,"Software Engineering focuses on designing, developing, testing, and maintaining software systems using structured engineering principles. Students learn programming, software architecture, algorithms, databases, and system design to build reliable and scalable applications. The field suits individuals who are logical, detail-oriented, and interested in technology, problem-solving, and creating software solutions.",,,,
727,"Simulation Science, Games and Animation","Simulation Science, Games and Animation focuses on designing interactive digital environments, simulations, and visual experiences using technology and creative storytelling. Students learn programming, computer graphics, game design, animation, physics simulation, and user interaction to develop games, virtual simulations, and immersive media. The field suits individuals who are creative, tech-oriented, and interested in combining design, storytelling, and technology.",,,,
726,Safety Management,"Safety Management focuses on developing and implementing systems to prevent accidents, reduce risks, and ensure compliance with safety regulations across organizations. Students learn risk assessment, safety standards, incident investigation, environmental health, and management systems to create safe working environments. The field suits individuals who are detail-oriented, responsible, and interested in risk control, compliance, and workplace safety.",,,,
725,Technical Management,"Technical Management focuses on leading and managing technology-driven projects, teams, and operations within organizations. Students learn project management, technology strategy, systems management, and leadership to bridge the gap between technical teams and business objectives. The field suits individuals who have a technical background and are interested in leadership, coordination, and decision-making in technology environments.",,,,
724,Pilot Operations,"Pilot Operations focuses on the knowledge and skills required to operate aircraft safely and efficiently in commercial or private aviation. Students learn flight theory, navigation, meteorology, aviation safety, aircraft systems, and regulatory procedures, along with practical flight training. The field suits individuals who are disciplined, detail-oriented, and interested in aviation, technology, and high-responsibility operational roles.",,,,
723,Occupational Safety Management,"Occupational Safety Management focuses on identifying, evaluating, and controlling workplace hazards to ensure employee health and safety. Students learn safety regulations, risk assessment, industrial hygiene, environmental health, and management systems to prevent accidents and ensure compliance. The field suits individuals who are detail-oriented, responsible, and interested in workplace safety, risk management, and regulatory standards.",,,,
722,Logistics and Supply Chain Management,"Logistics and Supply Chain Management focuses on planning, coordinating, and optimizing the flow of goods, information, and resources from production to end consumers. Students learn logistics operations, procurement, inventory management, transportation, data analysis, and supply chain strategy to improve efficiency and reduce costs. The field suits individuals who are analytical, organized, and interested in operations, global trade, and problem-solving in dynamic business environments.",,,,
721,Leadership,"Leadership focuses on developing the skills and strategies needed to guide individuals, teams, and organizations toward achieving goals. Students learn leadership theories, organizational behavior, communication, decision-making, and strategic management to effectively lead in diverse and dynamic environments. The field suits individuals who are proactive, people-oriented, and interested in management, influence, and organizational impact.",,,,
720,Human Security and Resilience,"Human Security and Resilience focuses on protecting individuals and communities from threats such as conflict, disasters, poverty, and environmental risks while strengthening their ability to adapt and recover. Students learn human security frameworks, risk analysis, public policy, development studies, and crisis response to address global challenges and build sustainable, resilient societies. The field suits individuals who are socially driven, analytical, and interested in humanitarian work, policy, and global development.",,,,
719,Human Factors Psychology,"Human Factors Psychology focuses on understanding how human cognition, perception, and behavior influence interactions with systems and environments. Students study cognitive psychology, human performance, decision-making, and ergonomics to improve usability, safety, and user experience. The field suits individuals who are analytical, user-focused, and interested in applying psychology to real-world design and performance challenges.",,,,
718,Human Factors,"Human Factors focuses on understanding how people interact with systems, products, and environments to improve safety, efficiency, and user experience. Students learn cognitive psychology, ergonomics, human-computer interaction, and system design to optimize performance and reduce human error. The field suits individuals who are analytical, user-focused, and interested in designing systems that align with human capabilities and behavior.",,,,
717,Homeland Security and Intelligence,"Homeland Security and Intelligence focuses on protecting national security through threat analysis, intelligence gathering, and crisis response. Students learn intelligence analysis, counterterrorism strategies, emergency management, public policy, and coordination across government agencies to prevent and respond to security threats. The field suits individuals who are analytical, disciplined, and interested in national security, intelligence operations, and public sector work.",,,,
716,Homeland Security,"Homeland Security focuses on protecting a nation’s infrastructure, people, and institutions from threats such as terrorism, natural disasters, and cyber attacks. Students learn security strategy, emergency management, risk assessment, public policy, and coordination across government agencies to prevent, respond to, and recover from crises. The field suits individuals who are disciplined, analytical, and interested in public safety, national security, and crisis management.",,,,
715,Global Security & Intelligence Studies,"Global Security & Intelligence Studies focuses on analyzing and managing security threats at national and international levels, including terrorism, cyber threats, and geopolitical risks. Students learn intelligence analysis, cybersecurity fundamentals, international relations, data analysis, and risk assessment to support decision-making in security and defense contexts. The field suits individuals who are analytical, discreet, and interested in global affairs, security strategy, and intelligence operations.",,,,
714,Global Conflict Studies,"Global Conflict Studies examines the causes, dynamics, and resolution of conflicts at local, national, and international levels. Students study political systems, international relations, history, social structures, and conflict resolution strategies to understand issues such as war, terrorism, human rights, and peacebuilding. The field suits individuals who are analytical, globally minded, and interested in diplomacy, security, and social impact.",,,,
713,Global Business & Supply Chain Management,"Global Business & Supply Chain Management focuses on managing international business operations and the flow of goods, information, and finances across global markets. Students learn supply chain strategy, logistics, procurement, international trade, operations management, and data analysis to optimize efficiency and competitiveness. The field suits individuals who are analytical, strategic, and interested in global commerce, coordination, and problem-solving in complex business environments.",,,,
712,Forensic Psychology,"Forensic Psychology applies psychological principles to the criminal justice system, focusing on understanding criminal behavior, assessing offenders, and supporting legal processes. Students study psychology, criminology, mental health assessment, and legal procedures to evaluate individuals involved in crimes and court cases. The field suits those interested in human behavior, mental processes, and working within legal or correctional settings.",,,,
711,Forensic Biology,"Forensic Biology focuses on the analysis of biological evidence in criminal investigations, particularly DNA, blood, bodily fluids, and other organic materials. Students learn molecular biology, genetics, biochemistry, and laboratory techniques used to identify individuals and reconstruct crime events. The field suits those who are detail-oriented, analytical, and interested in applying life sciences to real-world investigative work.",,,,
710,Forensic Accounting and Fraud Examination,"Forensic Accounting and Fraud Examination focuses on investigating financial records to detect fraud, financial crimes, and legal disputes. Students learn accounting, auditing, financial analysis, fraud detection techniques, and legal procedures related to financial investigations. The field suits individuals who are detail-oriented, analytical, and interested in combining finance with investigation and compliance rather than general business operations.",,,,
709,Engineering Technology,"Engineering Technology focuses on the practical application of engineering principles to support the implementation, operation, and maintenance of technical systems. Students learn applied engineering concepts, technical problem-solving, equipment operation, and hands-on skills related to manufacturing, electronics, and industrial systems. The field suits individuals who prefer practical, application-oriented work and want to work closely with technology and systems rather than theoretical design.",,,,
708,Engineering Physics,"Engineering Physics focuses on applying fundamental physics principles to solve complex engineering problems, bridging theoretical science and practical technology development. Students study advanced physics, mathematics, materials science, and engineering concepts such as electronics, mechanics, and computational methods. The field suits individuals who are strong in math and physics and want flexible pathways into research, advanced engineering, or high-tech industries.",,,,
707,Engineering Management,"Engineering Management focuses on applying management principles to engineering projects, teams, and organizations. Students learn project management, operations, finance, and leadership alongside engineering fundamentals to bridge technical and business functions. The field suits individuals with a technical background who want to move into leadership, coordination, or strategic roles rather than purely technical positions.",,,,
706,Engineering Fundamentals,"Engineering Fundamentals focuses on foundational principles across multiple engineering disciplines, including basic physics, mathematics, materials, and introductory design concepts. Students learn problem-solving, technical analysis, and core engineering concepts that prepare them for specialized fields such as mechanical, electrical, or civil engineering. The field suits individuals who want a broad introduction to engineering before choosing a specific specialization.",,,,
705,Emergency Services,"Emergency Services focuses on responding to urgent situations such as medical emergencies, accidents, and disasters through frontline operations and public safety support. Students learn emergency response procedures, basic medical care, crisis handling, and coordination with healthcare and public safety systems. The field suits individuals who are action-oriented, resilient, and interested in hands-on roles that involve protecting lives and providing immediate assistance in critical situations.",,,,
704,Emergency Management,"Emergency Management focuses on preparing for, responding to, and recovering from natural and man-made disasters through coordinated planning and risk management. Students study disaster response, crisis management, public safety systems, risk assessment, and emergency planning. The field suits individuals who are organized, resilient, and interested in protecting communities and managing crises within government, nonprofit, or public safety sectors.",,,,
703,Electrical Engineering & Computer Science,"Electrical Engineering & Computer Science focuses on the integration of hardware and software systems, combining electrical engineering principles with computing and software development. Students study circuits, electronics, signals, and embedded systems alongside programming, algorithms, and computer systems. The field suits individuals who are interested in both hardware and software and want flexibility to work across areas such as software engineering, AI, electronics, or system design.",,,,
702,Cyber Intelligence and Security,"Cyber Intelligence and Security focuses on protecting digital systems, networks, and data through cybersecurity practices, threat analysis, and intelligence gathering. Students learn network security, cryptography, ethical hacking, digital forensics, and cyber threat intelligence. The field suits individuals who are analytical, detail-oriented, and interested in defending systems against cyber threats and understanding how attacks are detected and prevented.",,,,
701,Computational Mathematics,"Computational Mathematics focuses on using mathematical models, algorithms, and numerical methods to solve complex problems through computing. Students study applied mathematics, programming, data analysis, numerical simulation, and algorithm design. The field suits individuals who are analytical, enjoy problem-solving, and are interested in applying mathematics in areas such as technology, data, engineering, or scientific computing.",,,,
700,Commerce,,,,,
699,English with Media Studies,,,,,
698,Malayalam with Mass Communication,,,,,
697,History,,,,,
696,Business Administration in Aviation,"Business Administration in Aviation focuses on applying core business principles within the aviation industry, including airlines, airports, and aviation services. Students study finance, marketing, operations, and management alongside aviation-related topics such as airline operations and aviation regulations. The field suits individuals who are interested in business roles within aviation and prefer strategic or operational work over technical or engineering paths.",,,,
695,Business Administration in Aviation Management,"Business Administration in Aviation Management focuses on applying business and management principles specifically within the aviation industry, including airlines, airports, and aviation services. Students study finance, operations management, strategy, and leadership alongside aviation-specific topics such as airline operations, airport management, and aviation regulations. The field suits individuals who are interested in managing aviation organizations and making strategic business decisions rather than technical or engineering roles.",,,,
694,Aviation Safety,"Aviation Safety focuses on ensuring safe flight operations through risk management, accident prevention, and compliance with aviation regulations. Students learn safety systems, human factors, incident analysis, and aviation laws. The field suits individuals who are detail-oriented, responsible, and interested in maintaining safety standards and minimizing risks within aviation environments rather than technical design or business roles.",,,,
693,Aviation Maintenance Science,"Aviation Maintenance Science focuses on the inspection, repair, and maintenance of aircraft to ensure safety and airworthiness. Students learn aircraft systems, maintenance procedures, diagnostics, aviation regulations, and safety standards. The field suits individuals who are hands-on, detail-oriented, and interested in the technical upkeep and reliability of aircraft rather than design or business roles.",,,,
692,Aviation Finance,"Aviation Finance focuses on the financial management and economic aspects of the aviation industry, including airlines, airports, and aircraft leasing companies. Students study corporate finance, accounting, investment analysis, and aviation-specific topics such as airline revenue management, fleet financing, and cost control. The field suits individuals who are interested in finance and business decision-making within the aviation sector rather than technical or operational roles.",,,,
691,Aviation Business Administration,"Aviation Business Administration focuses on the management and commercial operations of the aviation industry, including airlines, airports, and aviation service organizations. Students study business fundamentals such as finance, marketing, operations management, and aviation-specific topics like airline economics, airport management, and aviation regulations. The field suits individuals who are interested in business strategy and operations within the aviation sector rather than technical or engineering roles.",,,,
690,Aviation and Aerospace Sustainability,"Aviation and Aerospace Sustainability focuses on reducing the environmental impact of air and space transportation through sustainable technologies, policies, and operational strategies. Students study climate science, sustainable aviation fuels, emissions reduction, environmental regulations, and the interaction between aerospace systems and the environment. The field suits individuals who are interested in sustainability, climate impact, and applying environmental solutions within the aviation and aerospace industry.",,,,
689,Aviation and Aerospace Safety,"Aviation and Aerospace Safety focuses on ensuring the safety of aircraft, flight operations, and aerospace systems through risk management, accident prevention, and regulatory compliance. Students study aviation safety systems, human factors, accident investigation, safety regulations, and operational risk analysis. The field suits individuals who are detail-oriented, responsible, and interested in maintaining safety standards within aviation and aerospace environments rather than designing aircraft.",,,,
688,Aviation and Aerospace Safety,"Aviation and Aerospace Safety focuses on ensuring the safety of aircraft, flight operations, and aerospace systems through risk management, accident prevention, and regulatory compliance. Students study aviation safety systems, human factors, accident investigation, safety regulations, and operational risk analysis. The field suits individuals who are detail-oriented, responsible, and interested in maintaining safety standards within aviation and aerospace environments rather than designing aircraft.",,,,
687,Aviation,"Aviation focuses on the operation, management, and technical aspects of air transport systems, including flight operations, airport management, aviation safety, and air traffic control. Students learn about aviation systems, navigation, meteorology, regulations, and airline operations. The field suits individuals who are interested in the aviation industry, enjoy structured environments, and may pursue roles related to piloting, operations, or aviation management rather than purely engineering design.",,,,
686,Applied Meteorology,"Applied Meteorology focuses on using atmospheric science to solve real-world problems related to weather, climate, and environmental systems. Students study meteorology, climatology, data analysis, forecasting models, and the interaction between the atmosphere and human activities. The field suits individuals who are analytical, interested in weather patterns and environmental impact, and want to apply scientific knowledge to areas such as forecasting, climate risk, and environmental planning.",,,,
685,Airworthiness Engineering,"Airworthiness Engineering is a specialized discipline focused on ensuring that aircraft and their components meet rigorous safety and regulatory standards throughout their entire lifecycle. Students learn to evaluate structural integrity, system reliability, and environmental impacts while navigating complex certification processes from aviation authorities. The curriculum combines high-level engineering principles with legal frameworks to prevent mechanical failure and ensure public safety. This field is ideal for methodical thinkers who are dedicated to technical precision, safety auditing, and the continuous improvement of aviation standards.",,,,
684,Airport and Air Mobility Management,"Airport and Air Mobility Management focuses on the complex coordination of airport infrastructure, traditional flight operations, and the integration of emerging Advanced Air Mobility (AAM) technologies. Students master terminal logistics, regulatory compliance, and airspace safety while exploring the development of vertiports and drone ecosystems. This field is ideal for strategic planners and operations-minded individuals who aim to optimize global aviation networks and lead the transition toward a highly automated and sustainable urban flight environment.",,,,
683,Airline Management,"Airline Management focuses on the business and operational aspects of the aviation industry, including strategic planning, safety regulations, and fleet management. Students learn to optimize airline performance through revenue management, human resource coordination, and compliance with international aviation laws. This field is ideal for those who aim to lead complex organizational structures and ensure the seamless integration of technical flight operations with commercial success.",,,,
