id,title,description,admission_requirements,recommended_skills,entrance_exams,language_requirements
456,Liberal Arts,"Liberal Arts focuses on a broad, interdisciplinary education that develops critical thinking, communication, and analytical skills across multiple fields of study. Students typically explore subjects in the humanities, social sciences, and natural sciences while learning how to evaluate ideas, interpret information, and communicate effectively. The program emphasizes intellectual flexibility and a well-rounded academic foundation rather than specialization in a single technical field. This field is suitable for individuals who enjoy exploring diverse subjects and developing versatile skills that can be applied across many professional areas.",,,,
455,Computer Engineering Technology,"This field focuses on the practical application of computer engineering principles to design, build, and maintain computer systems and embedded hardware. Students learn programming, digital systems, microcontrollers, networking, and hardware-software integration, with an emphasis on hands-on technical skills. It is suitable for individuals interested in both hardware and software, and who want to work with computer systems, electronics, and modern technology solutions.",,,,
454,Early Childhood Education and Early Intervention,"Early Childhood Education and Early Intervention focuses on the development, education, and support of young children, typically from birth through early elementary years. Students learn about child development, early learning strategies, classroom management, and educational assessment while also studying methods to support children with developmental delays or special needs. The program prepares students to create inclusive learning environments and collaborate with families and specialists to support children’s cognitive, social, and emotional development. This field is suitable for individuals who are patient, nurturing, and interested in supporting early childhood learning and development.",,,,
452,Motorsports Technology,"This field focuses on the design, performance, and maintenance of high-speed vehicles used in racing and motorsports. Students learn about vehicle dynamics, engine performance, aerodynamics, data analysis, and advanced mechanical systems, often combining engineering theory with hands-on experience. It is suitable for individuals passionate about automotive performance, racing environments, and applying engineering principles to optimize speed, safety, and efficiency.",,,,
451,Biblical Interpretation,"This major focuses on the study and interpretation of biblical texts, examining historical context, literary structure, theological themes, and hermeneutical methods. Students develop skills in critical analysis, textual interpretation, ethical reasoning, and religious scholarship. The program is suitable for students interested in theology, religious education, ministry leadership, and academic research within faith-based or scholarly settings.",,,,
450,Industrial Design,"This field focuses on designing and developing products that are functional, aesthetic, and user-centered, combining creativity with technical and manufacturing knowledge. Students learn product design, materials, ergonomics, prototyping, and production processes while developing problem-solving and design thinking skills. It is suitable for individuals interested in creating physical products, improving user experience, and working at the intersection of design, technology, and innovation.",,,,
449,Liberal Arts & Sciences: Math & Science,"This interdisciplinary field combines mathematical reasoning with scientific exploration of the natural world. Students develop strong quantitative, analytical, and problem-solving skills while studying core areas such as mathematics, physics, chemistry, and biology. It is suitable for individuals who enjoy logical thinking, working with data, and understanding how natural systems operate, and who seek flexible pathways into science, technology, research, or advanced study.",,,,
448,Applied Psychology,"This major focuses on applying psychological principles to real-world problems in areas such as mental health, organizational behavior, education, and human development. Students learn about behavioral assessment, counseling techniques, research methods, and intervention strategies. It is suitable for individuals interested in understanding human behavior and using that knowledge to improve individual and community well-being.",,,,
447,Nursing Dual Degree,"This field focuses on preparing students for professional nursing practice through a combination of theoretical knowledge and clinical training. Students learn patient care, medical procedures, anatomy, pharmacology, and healthcare ethics, often with an extended or dual-degree structure that may include additional academic or specialization components. It is suitable for individuals who are compassionate, detail-oriented, and interested in providing direct patient care in healthcare settings.",,,,
446,Luxury Management,"Luxury Management focuses on managing high-end brands, products, and services across industries such as fashion, hospitality, retail, and lifestyle. Students study brand management, consumer behavior, marketing strategy, retail operations, and customer experience with an emphasis on exclusivity, storytelling, and premium positioning. This field suits individuals who are interested in business, branding, and the luxury market, with a strong sense of aesthetics, attention to detail, and an understanding of high-end consumer expectations.",,,,
445,Global Business and Management,"Global Business and Management focuses on managing business activities across international markets, combining core management principles with global strategy, cross-cultural communication, and international operations. Students study areas such as international business, marketing, finance, and organizational management while developing the ability to operate in diverse cultural and economic environments. This field suits individuals who are interested in global markets, enjoy working across cultures, and aim to build careers in multinational organizations or international business settings.",,,,
444,Welding Technology,"This field focuses on the techniques and technologies used to join metals and materials in construction, manufacturing, and industrial settings. Students learn welding processes such as MIG, TIG, and arc welding, along with blueprint reading, metallurgy basics, and safety standards. It is suitable for individuals who prefer hands-on work, have good precision and coordination, and are interested in working with machinery and metal structures.",,,,
442,American Sign Language,"American Sign Language focuses on learning the language, grammar, and cultural context of sign language used by Deaf and hard-of-hearing communities in the United States and other regions. The program develops skills in visual communication, sign language interpretation, and cross-cultural understanding while covering linguistics, Deaf culture, and communication strategies. Students learn how to communicate effectively using signs, facial expressions, and body language while understanding the social and cultural aspects of the Deaf community. This field is suitable for individuals interested in language, accessibility, and supporting communication between Deaf and hearing communities.",,,,
441,Professional Flight,"Professional Flight focuses on training students to become skilled pilots, combining aviation theory with extensive practical flight training. Students study aerodynamics, navigation, meteorology, aviation regulations, and aircraft systems while developing hands-on flying skills and safety procedures. This field suits individuals who are disciplined, detail-oriented, and passionate about aviation, with strong decision-making abilities and the ability to perform under pressure.",,,,
440,Game Development Concentration,"Game Development Concentration focuses on the design and development of digital games across platforms such as computers, consoles, and mobile devices. Students learn how to build interactive game systems using programming, game engines, graphics, and software development tools. The curriculum typically covers game programming, computer graphics, game design principles, artificial intelligence for games, and user experience. This field is suitable for individuals who enjoy coding, problem-solving, and creating interactive digital experiences within the gaming and entertainment industry.",,,,
438,Applied Artificial Intelligence Concentration,"Applied Artificial Intelligence Concentration focuses on the practical use of artificial intelligence technologies to solve real-world problems across industries. Students learn how to design, develop, and apply AI systems using techniques such as machine learning, data analysis, natural language processing, and intelligent automation. The program combines computer science fundamentals with hands-on experience in building AI-driven applications. This field is suitable for individuals who are analytical, interested in technology and data, and motivated to create intelligent systems that improve decision-making and efficiency.",,,,
436,Technology Management,"Technology Management is a specialized field that bridges the gap between business management and engineering/technology. It focuses on the strategic planning, development, and implementation of technological capabilities to shape and accomplish the strategic and operational objectives of an organization. The discipline covers innovation management, R&D strategy, technology life cycle assessment, and digital transformation, preparing professionals to lead in tech-driven environments.",,,,
433,Master of Divinity in Healthcare Chaplaincy,"Master of Divinity in Healthcare Chaplaincy prepares students to provide spiritual care and emotional support within healthcare environments such as hospitals, clinics, and hospice centers. The program combines studies in theology, pastoral counseling, ethics, and spiritual care with specialized training in healthcare ministry, crisis support, and interfaith communication. Students learn how to assist patients, families, and medical staff in coping with illness, grief, ethical dilemmas, and end-of-life situations while respecting diverse religious and cultural backgrounds. This field is suitable for individuals called to religious service who want to work in healthcare settings providing compassionate spiritual guidance and pastoral care.",,,,
432,Public Relations Concentration,"Public Relations Concentration focuses on managing communication between organizations and their audiences to build and maintain a positive public image. Students learn how to develop communication strategies, manage media relations, create persuasive messaging, and handle public communication during both routine operations and crises. The curriculum typically covers strategic communication, media writing, branding, digital communication, and reputation management. This field is suitable for individuals who are strong communicators, strategic thinkers, and interested in shaping how organizations interact with the public and media.",,,,
431,Biblical Studies,"Biblical Studies focuses on the academic study of the Bible, examining its historical context, literary structure, original languages, theology, and cultural impact. Students develop skills in textual analysis, critical thinking, historical research, and ethical reasoning while exploring ancient civilizations and religious traditions. The major is suitable for students interested in religion, history, philosophy, education, and research-oriented careers.",,,,
430,Early Childhood Education Director Concentration,"Early Childhood Education Director Concentration focuses on leadership and management within early childhood education settings. Students learn how to oversee preschool or childcare programs while developing skills in educational leadership, curriculum planning, staff supervision, budgeting, and regulatory compliance. The program combines knowledge of child development and early learning with administrative and organizational management. This field is suitable for individuals who are interested in leading early childhood programs and ensuring high-quality educational environments for young children.",,,,
429,Liberal Arts & Sciences: Social Science,"Liberal Arts & Sciences: Social Science focuses on the systematic study of human society, social relationships, and individual behavior within a global context. Students master the complexities of psychological theories, sociological research methods, and political systems while developing high-level proficiency in data analysis and critical inquiry. The curriculum integrates the diverse perspectives of history, economics, and geography to analyze complex social challenges and institutional structures. This field is ideal for analytical thinkers and socially-conscious individuals who aim to build a strong academic bridge to bachelor’s programs in law, social work, public administration, or criminal justice, emphasizing the power of evidence-based reasoning and societal impact.",,,,
428,Juris Doctor (JD),"Juris Doctor (JD) focuses on preparing students for professional legal practice and the interpretation and application of law. The program provides comprehensive training in legal principles, including constitutional law, contracts, criminal law, civil procedure, property law, and legal research and writing. Students develop critical thinking, argumentation, and analytical skills while learning how to interpret legal systems, represent clients, and address complex legal issues in various sectors. This field is suitable for individuals interested in justice, public policy, and legal advocacy who want to pursue careers in legal practice, government, or corporate law.",,,,
427,Digital Marketing,"Digital Marketing is a dynamic field that leverages the internet and online based technologies to reach consumers. The curriculum covers key disciplines such as Search Engine Optimization (SEO), Pay-Per-Click (PPC) advertising, content marketing, and social media strategy. Students learn to use analytics tools to track campaign performance, understand consumer behavior in the digital space, and create engaging content that drives brand awareness and sales.",,,,
426,Clinical Psychology,"Clinical Psychology focuses on the assessment, diagnosis, prevention, and treatment of mental health disorders and emotional difficulties.
The field combines psychological theory, research methods, psychotherapy techniques, and psychological testing to support individuals across the lifespan.
Students study abnormal psychology, psychopathology, psychological assessment, psychotherapy approaches (CBT, psychodynamic, humanistic), neuroscience, ethics, and research methods.",,,,
425,Marketing Management,"Marketing Management focuses on planning, executing, and analyzing marketing strategies to promote products, services, and brands in competitive markets. Students study consumer behavior, market research, branding, digital marketing, and strategic management while developing skills in communication, data analysis, and decision-making. This field suits individuals who are creative yet analytical, interested in understanding customers, and motivated to drive business growth through effective marketing strategies.",,,,
424,Management and Optimization of Supply Chains and Transport,"Management and Optimization of Supply Chains and Transport focuses on designing, managing, and improving the flow of goods, information, and resources across supply chain networks. Students learn about logistics operations, transportation systems, supply chain analytics, inventory management, and optimization strategies that improve efficiency and reduce operational costs. The program combines management principles with analytical and technological tools used to coordinate global supply chains. This field is suitable for individuals who are interested in logistics systems, transportation networks, and improving operational performance in global trade and distribution.",,,,
423,"Master of Arts in Psychology, Mental Health Track","A Master of Arts (MA) in Psychology with a Mental Health track provides advanced training in psychological theories, diagnosis, and therapeutic techniques to prepare students for careers as counselors, therapists, or mental health service providers. These programs often integrate social, developmental, and neuroscientific approaches to mental health, focusing on practical skills for treating clients.",,,,
422,Music Education – Instrumental (BM),"Music Education – Instrumental prepares students to teach instrumental music in schools and community programs while developing strong skills in music performance and pedagogy. The program combines studies in instrumental technique, conducting, ensemble leadership, music theory, ear training, and music history with coursework in educational psychology and teaching methods. Students learn how to instruct individuals and ensembles, manage band or orchestra programs, and design music curricula for different age groups. This field is suitable for individuals who are passionate about instrumental music and want to build careers in music teaching, ensemble direction, and arts education.",,,,
421,Social Work,"Social Work focuses on improving the well-being of individuals, families, and communities by addressing social inequality, access to resources, and systemic challenges. The field combines social policy, community intervention, and support services to assist vulnerable populations and promote social justice.",,,,
420,Cybersecurity Concentration,"Cybersecurity Concentration focuses on protecting computer systems, networks, and digital information from cyber threats and unauthorized access. Students learn how to identify security vulnerabilities, implement security protocols, and respond to cyber incidents using technical and analytical approaches. The curriculum typically includes network security, cryptography, ethical hacking, digital forensics, and risk management. This field is suitable for individuals who are analytical, detail-oriented, and interested in safeguarding digital infrastructure and information in an increasingly connected world.",,,,
419,Software Engineering Concentration,"Software Engineering Concentration focuses on the design, development, testing, and maintenance of software systems. Students learn how to build reliable and scalable software using programming languages, algorithms, and modern development frameworks. The curriculum typically covers software architecture, database systems, system design, debugging, quality assurance, and collaborative development practices. This field is suitable for individuals who enjoy problem-solving, logical thinking, and building digital solutions used in applications, platforms, and large-scale technology systems.",,,,
418,Business Administration,"Business Administration is a comprehensive field of study that focuses on the fundamental principles of managing and operating an organization. This major integrates various core disciplines, including accounting, finance, marketing, human resources, and operations management, to develop a holistic understanding of how businesses function in a global marketplace. Students learn to apply analytical and strategic thinking to solve organizational challenges, optimize resources, and lead teams effectively. It is designed for individuals who aspire to leadership roles, fostering the skills necessary to drive innovation, manage risk, and ensure sustainable growth in diverse corporate and entrepreneurial environments.",,,,
417,Worship Leadership (BM),"Worship Leadership focuses on preparing students to lead music and coordinate worship experiences in religious and faith-based settings. The program combines training in vocal or instrumental performance, worship music styles, conducting, music theory, and arranging with studies in theology, ministry leadership, and worship planning. Students learn how to organize worship services, direct choirs or worship bands, and manage music ministries while developing leadership, communication, and musical collaboration skills. This field is suitable for individuals who are passionate about music, leadership, and spiritual service, and who want to guide worship through music in churches and religious organizations.
Worship Leadership focuses on preparing students to lead music and coordinate worship experiences in religious and faith-based settings. The program combines training in vocal or instrumental performance, worship music styles, conducting, music theory, and arranging with studies in theology, ministry leadership, and worship planning. Students learn how to organize worship services, direct choirs or worship bands, and manage music ministries while developing leadership, communication, and musical collaboration skills. This field is suitable for individuals who are passionate about music, leadership, and spiritual service, and who want to guide worship through music in churches and religious organizations.",,,,
416,Healthcare Management,"This field focuses on managing healthcare organizations, services, and operations to ensure efficient delivery of medical care. Students learn healthcare systems, administration, finance, policy, and leadership, along with organizational and strategic management skills. It is suitable for individuals interested in the healthcare sector who prefer management, coordination, and decision-making roles rather than direct clinical practice.",,,,
415,Osteopathic Medicine,"Osteopathic Medicine prepares students to become physicians trained in a holistic approach to healthcare, emphasizing the interrelationship between structure and function of the body. Students study biomedical sciences, clinical medicine, pathology, pharmacology, and patient care, along with specialized training in osteopathic manipulative treatment (OMT). The program is rigorous and clinically intensive, designed for students committed to becoming licensed physicians who value comprehensive, patient-centered care.",,,,
414,Technical Studies,"Technical Studies focuses on developing practical technical knowledge and applied problem-solving skills across various technology and industry-related fields. The program typically combines foundational studies in mathematics, science, and technology with hands-on training in technical systems, equipment operation, and applied engineering concepts. Students learn how to apply technical knowledge to real-world workplace environments, support technical operations, and adapt to different industrial or technological roles. This field is suitable for individuals interested in applied technical work and pursuing careers in technical support, industrial operations, and technology-related environments.",,,,
412,Vocal Performance (BM),"Vocal Performance focuses on developing advanced singing technique and artistic expression for professional stage and recording careers. The program provides intensive training in vocal technique, breath control, diction, interpretation, and stage performance across a range of musical styles such as classical, opera, and contemporary repertoire. Students also study music theory, ear training, language for singers, and music history while gaining extensive performance experience through recitals, operas, and ensembles. This field is suitable for individuals who are passionate about singing and want to pursue professional careers in vocal performance, recording, teaching, or the broader performing arts industry.",,,,
410,Counseling Psychology,"Counseling Psychology focuses on understanding human behavior, emotional well-being, and psychological development while helping individuals cope with personal, social, and mental health challenges. Students study psychological theories, counseling techniques, human development, and therapeutic communication while learning how to support individuals in managing stress, relationships, and life transitions. The program prepares graduates to work in counseling, mental health support, and behavioral services. This field is suitable for individuals who are empathetic, interested in human behavior, and motivated to help others improve their mental and emotional well-being.",,,,
409,Game & Interactive Design,"This field focuses on designing and developing interactive digital experiences, including video games and interactive media. Students learn game design principles, storytelling, user experience, programming basics, and 2D/3D asset creation, combining creativity with technical skills. It is suitable for individuals who enjoy both design and technology, are interested in gaming or interactive media, and want to create engaging digital products.",,,,
408,International Relations and Globalization,"International Relations and Globalization examines the interactions between countries, international organizations, and global systems, focusing on politics, economics, diplomacy, and cross-border issues such as trade, security, and cultural exchange. Students study international policy, global governance, political theory, and the impact of globalization on societies and economies while developing analytical, research, and communication skills. This field suits individuals interested in world affairs, geopolitics, international cooperation, and understanding complex global challenges.",,,,
